"Topic";"Count";"Name";"CustomName";"Representation";"Representative_Docs";"carrera"
"0";"46";"0_recursos humanos_empresa_proceso_personal";"Gestión Estratégica de Recursos Humanos en Empresas: Procesos y Herramientas.";"['recursos humanos', 'empresa', 'proceso', 'personal', 'desarrollo', 'reclutamiento selección', 'salta', 'herramientas', 'empleados', 'horas']";"['el desarrollo de carrera de los jóvenes no profesionales a través de la técnica de mentoring en mkd s.a.. el presente trabajo analiza el desarrollo profesional de los operadores telefónicos a través de la aplicación de un plan de carrera con la implementación de la técnica de mentoring en la empresa mkd s.a. de salta capital. se investigó la viabilidad que los operadores telefónicos, por medio de un plan de carrera planificado y organizado objetivamente con el acompañamiento de un mentor, pudieran ocupar otros puestos de mayor jerarquía dentro de la empresa. para esta investigación se ha recolectado información mediante las técnicas de la encuesta y la entrevista. se tomó una muestra de   operadores telefónicos, a quienes se consultó sobre sus expectativas en materia de desarrollo profesional y acerca del desempeño de su superior directo. las entrevistas con informantes claves, el gerente del área de recursos humanos, el coordinador del call center y un analista de recursos humanos buscaron conocer aspectos acerca de las posibilidades de crecimiento de los operadores telefónicos. los resultados reflejaron que la mayor parte de los operadores telefónicos de mkd s.a. se están formando académicamente en áreas relacionadas a las actividades de la empresa, que tienen intenciones de graduarse y que se muestran expectantes en términos de su desarrollo profesional. también, se pudieron detectar los puestos que serían competentes para cumplir con la función de mentor. se concluye que la aplicación de un plan de desarrollo de carrera destinada a estos operadores, aun cuando tuviera el propósito central de unificar criterios para llevar adelante las promociones internas, también traería beneficios tales como el refuerzo del contrato psicológico, la retención del talento y un apalancamiento positivo en la productividad.', 'gestión estrategica de recursos humanos, desarrollo e implementación de los procesos correspondientes a los subsistemas de integración y organización en la empresa colorearg durante el año  . los subtemas de desarrollo y organización de chiavenato se basan en el correcto proceso de reclutamiento y selección de personal los cuales están acompañados de un análisis y descripción de puestos. estas herramientas son fundamentales para poder incorporar capital humano valioso para la organización. el reclutamiento es el proceso que realiza la empresa para poder identificar y atraer a los candidatos para cubrir el puesto bacante, dichos candidatos pueden provenir del ambiente interno como externo. el siguiente paso para la adquisición de personal es la selección, proceso en el cual se evalúan las cualidades, conocimientos, habilidades y la experiencia del candidato. el objetivo de dicho proceso es elegir al candidato que cumpla de manera adecuada con las exigencias del puesto. tanto el reclutamiento como la selección tienen su base de acción en el análisis y descripción de puestos, en él se especifican que tipo de conocimientos, habilidades, competencias, exigencias, funciones y responsabilidades van a exigir el puesto a la persona, para el correcto desempeño de la misma en la organización. tomando en cuenta lo anterior y recalcando la importancia de estos procesos en el correcto funcionamiento de las tareas, el presente trabajo pretende aplicar de forma adecuada los subsistemas de integración y organización en la empresa colorearg y así contribuir a mejorar el desempeño de los trabajadores...', 'proceso de reclutamiento y selección de asesores comerciales en una empresa privada de comercialización de vehículos de la provincia de jujuy. cualquier organización, independientemente de su tamaño, debe procurar contar con el personal adecuado y calificado en cada uno de sus puestos de trabajo, para garantizar su funcionamiento. esto se logra gracias a la administración de recursos humanos, mediante su función de reclutamiento y selección de personal. el tema de la presente investigación es sobre el proceso de reclutamiento y selección de asesores comerciales en una empresa privada de comercialización de vehículos de la provincia de jujuy durante los años   y  . la empresa seleccionada para el estudio es autosol s.r.l. es una empresa que se dedica al rubro de ventas y comercialización de autos   km y usados certificado por normas de calidad iso  ; cuenta con una casa central dedica a la venta directa y una sucursal para comercialización de planes de ahorros. la función de reclutamiento y selección, está destinada a proveer de manera oportuna y a un costo adecuado de personal calificado a la organización. atendiendo a estos planteamientos la presente investigación tuvo como objetivo principal, describir el proceso de reclutamiento y selección de asesores comerciales implementado por la empresa autosol s.r.l de san salvador de jujuy en el periodo  . se pensó en los asesores comerciales porque gran parte de los ingresos de esta empresa dependen de la capacidad para vender los productos y servicios de la misma; es por ello que los asesores comerciales deben disponer de cierto talento humano calificado en sus tareas, y así satisfacer las necesidades de sus clientes y alcanzar los objetivos de la organización. el problema es que el reclutamiento y selección de personal no es tarea fácil, no es una ciencia exacta, siempre cabe la posibilidad de un error. cuando esto sucede, el resultado es la incorporación a la empresa de personas que pueden no ser funcionales. describir este proceso permitirá conocer cómo actúa la empresa autosol s.r.l. para atraer y seleccionar candidatos para el cargo de asesores comerciales...']";"Licenciatura en Recursos Humanos"
"1";"27";"1_investigación_recursos humanos_gestión_empleados";"Gestión de Recursos Humanos: Salud, Estrés y Retención de Empleados";"['investigación', 'recursos humanos', 'gestión', 'empleados', 'relación', 'salud', 'desempeño', 'social', 'teletrabajo', 'estrés']";"['la rotación y las políticas de retención de personal en el gimnasio xx período  . este trabajo final de graduación aborda el tema de la relación entre la rotación externa y las políticas de retención de personal en un gimnasio de la ciudad de salta capital, argentina, durante el periodo  . los objetivos específicos apuntaron a conocer el índice de rotación de personal dentro del gimnasio; a investigar si existen, y en caso afirmativo si se implementan, políticas de retención de personal; a detectar las posibles causas de rotación externa de personal y a identificar la relación entre el índice de rotación y las políticas de retención. la población estuvo compuesta por los   ex profesores; siete profesores vigentes; el propietario del lugar y tres secretarias. el tipo de investigación fue básica, retrospectiva, descriptiva y mixta, tanto cualitativa como cuantitativa. las fuentes empleadas fueron tanto primarias como secundarias: el testimonio de los profesores, ex profesores, del propietario y de la secretaria, y el material bibliográfico especializado, tanto impreso como digital. se concluye que el alto nivel de rotación de los profesionales de la educación física en este gimnasio se debe a la carencia de políticas específicas para retenerlos relacionadas con el desarrollo de una carrera profesional.', 'las tipologías relacionales del acoso laboral en propietarios y empleados de organizaciones del rubro comercial, en la ciudad de salta, durante el año  . el acoso laboral o mobbing es un problema que ocurre y ha ocurrido desde hace varias décadas. nacido en el seno del ámbito laboral y producto de una jerarquización, muchas veces sexista y de abuso de poder, ha permanecido mucho tiempo como tema tabú , debido a las controversias y cuestionamientos que genera en el ámbito laboral razón por la cual es un tema que debe ser tratado con especial cuidado y seriedad . esta problemática es la principal fuente de estrés laboral en las personas y en él convergen diversas tipologías de distres, el cual puede llegar a cronificarse y generar conflictos a nivel personal, familiar y profesional. en relación al acoso laboral relacional, se puede dar por parte de uno o varios compañeros, jefes o superiores bossing y, con mucha menor frecuencia, de los mismos subordinados que pueden someter a la víctima al maltrato psicológico a través de burlas, falsos rumores, amenazas, exclusión, desprecios y otras formas de maltratos , como asi también haciendo uso de la violencia física aunque esta se da en menor medida . en base a lo expuesto el presente trabajo de investigación pretende desentrañar las diversas tipologías existentes de acoso laboral poniendo énfasis en las diversas tipologías relacionales , y entender la manera en la cual impactan en la vida laboral de una persona y en el ámbito organizacional...', 'las condiciones de trabajo que afectan la calidad de vida de los oficiales superiores jefes de la policía de la provincia de salta. el presente trabajo de investigación denominado las condiciones de trabajo que afectan la calidad de vida de los oficiales superiores jefes de la policía de la provincia de salta, en el periodo   , está compuesto por cinco capítulos en los cuales se desarrolla el estudio de las consecuencias que afectan la calidad de vida de los oficiales superiores y jefes de la policía de la provincia de salta. el objetivo de dicho trabajo se origina en el análisis de la modalidad de trabajo que se implementa actualmente para los oficiales supriores y jefes. asimismo, en dicha investigación surge el planteamiento a indagar sobre los factores que afectan la calidad de vida del personal superior, contextualizado en el ámbito salud, familiar y laboral. consecuentemente el estudio realizado permitirá determinar la posibilidad llevar a cabo una nueva organización de los efectivos a los fines de propiciar a una mejora en la calidad de vida del personal, sin que ello signifique una disminución del cumplimiento de la función y responsabilidad que les compete. de la investigación realizada, surge que la mayoría de la población analizada considera la importancia de la presencia y supervisión de la figura del oficial superior y jefe en las diferentes áreas que le son asignados como titulares y responsables del buen funcionamiento de las mismas, sin embargo, teniendo en cuenta la organización del recurso a los fines de no causar perjuicios en el cumplimiento del servicio, surge la posibilidad de una mejor organización en la jornada laboral.']";"Licenciatura en Recursos Humanos"
"2";"12";"2_clima_clima organizacional_clima laboral_productividad";"Satisfacción Laboral y su Impacto en el Desempeño Organizacional";"['clima', 'clima organizacional', 'clima laboral', 'productividad', 'evaluación desempeño', 'empleados', 'satisfacción laboral', 'recursos humanos', 'desempeño laboral', 'cultura']";"['influencia de la satisfacción laboral en la productividad de la empresa nutrirec biofarma ,  . en los últimos años, la gestión de recursos humanos y la administración organizacional fue adaptándose a las nuevas tendencias y necesidades de los actores involucrados, aplicando teorías y herramientas que traten temas cómo la satisfacción laboral, la motivación de los trabajadores y la importancia del clima organizacional. es decir, recibir un salario alto no es el único factor que garantiza que los trabajadores realicen sus funciones cómo son esperadas por la empresa, sino que deben atenderse también otros aspectos de la gestión del personal. en este contexto, esta tesis se centra en un aspecto fundamental de la gestión de recursos humanos, la satisfacción laboral y su influencia en la productividad de la empresa nutrirec biofarma durante el año  . con el objetivo de contribuir a la mejora continua de la organización y generar conocimientos significativos sobre la gestión de recursos humanos en el sector industrial alimenticia. a medida que avanzamos en esta investigación, analizaremos la relación entre la satisfacción laboral y la productividad, y describiremos, identificaremos y evaluaremos su impacto en el desempeño de la empresa en el primer semestre de  ...', 'la evaluación de desempeño en cafe martínez y su incidencia en el nivel de desempeño de los trabajadores, en la ciudad de salta durante el año  . en el presente trabajo se indaga la importancia del uso de la evaluación de desempeño y su relevante repercusión en el nivel de desempeño de los recursos humanos de la organización, que permitirá mejorar la productividad, eficiencia y compromiso de los empleados de dicha empresa. la evaluación de desempeño presenta una profunda conexión con el desempeño laboral, es decir que el coopera a realizar este tipo de evaluación promoverá a los empleados a mejorar su eficiencia, productividad y comportamiento tanto en su puesto de trabajo como de manera general en la organización. también, a través de la misma, la empresa puede reconocer si existen fallas en el análisis y descripción de cargos, ya que los empleados están obligados a conocer cuáles son sus funciones y competencias para realizar su trabajo y desempeñar su puesto con mayor eficiencia. esto se ve ligado a la evaluación de desempeño, puesto que si existiera deficiencia en el análisis y descripción de los cargos los trabajadores no sabrían desempeñarse adecuadamente y por lo tanto fallarían al momento de ser evaluados, produciendo una contribución negativa para alcanzar los objetivos de la organización...']";"Licenciatura en Recursos Humanos"
"3";"25";"3_empleados_habilidades_motivación_liderazgo";"Desarrollo de Habilidades y Motivación en el Capital Humano Organizacional";"['empleados', 'habilidades', 'motivación', 'liderazgo', 'calidad', 'diferencias', 'recursos humanos', 'organizaciones', 'objetivos', 'capital']";"['los procesos de capacitaciones del capital humano de la facultad de artes y ciencias de la universidad católica de salta. david ulrich   , en su libro recursos humanos champions , sostiene que la capacitación y el desarrollo de los empleados son fundamentales para crear valor en la organización. cuando los empleados adquieren nuevas habilidades y conocimientos a través de la capacitación, pueden contribuir de manera más efectiva a la estrategia y los objetivos de la empresa, lo que mejora su ventaja competitiva. la noción de ventaja competitiva está estrechamente ligada a los principios de eficiencia, productividad y calidad del capital humano. por esta razón, en la actualidad, es imperativo que todas las organizaciones se centren en el desarrollo de su recurso intangible más valioso. esto se logra a través de la formación y gestión del conocimiento, que se enfoca en la adquisición, creación, organización, transferencia y aplicación efectiva del conocimiento en las organizaciones. el objetivo es mejorar el rendimiento, fomentar la innovación y optimizar el proceso de toma de decisiones. para ocupar cualquier tipo de posición en las organizaciones, las personas deben cumplir con una serie de requisitos que involucran el manejo de ciertas capacidades. estas capacidades se dividen en tres categorías principales: conocimientos, que pueden provenir de la educación formal como informal; competencias y valores que son las habilidades personales de cada uno y la experiencia que contribuye al desarrollo y fortalecimiento de las dos primeras...', 'incentivos no monetarios, motivación y desempeño laboral. el modo de incentivar al personal es uno de los aspectos centrales de la cultura de una empresa. en este contexto, la motivación es un factor clave en la gestión de talento humano, lo que lleva a que el departamento de recursos humanos sea una unidad operativa que funciona como órgano capaz de prestar servicios muy diversos, como por ejemplo el reclutamiento, la selección, el entrenamiento, la remuneración y por supuesto, las motivaciones e incentivos. la bibliografía relacionada a la gestión de los recursos humanos destaca que las personas pasan gran parte de sus vidas trabajando en empresas, las que dependen de las personas para operar, tanto como los individuos dependen de su trabajo para subsistir. por esta razón, separar el trabajo de la vida de las personas es casi imposible, ya que ambas partes mantienen una relación de dependencia mutua para obtener beneficios recíprocos. para que esta relación sea reciproca en términos justos, es fundamental el papel de la gestión de los rr.hh., la que debe contribuir a la eficacia organizacional a través de ayudar a la empresa a alcanzar sus objetivos, proporcionándole competitividad y logrando que los esfuerzos de las personas sean mas productivos para beneficiar a los cliente, socios y mismos empleados. en este marco, una buena gestión de los recursos humanos debe suministrar empleados motivados, considerando que no solo el dinero constituye el fundamento de la motivación humana. hoy esta aceptado que para mejorar el desempeño, existen otros factores, pues si bien los empleados satisfechos no siempre son los mas productivos, los insatisfechos tienden a desligarse de la empresa, se ausentan con frecuencia, no logran de manera eficiente y eficaz los objetivos o incluso no los alcanzan...', 'soft skills y desempeño laboral de los trabajadores del área de rrhh de la empresa natur s.a.. las soft skills, habilidades blandas en español, son determinantes para que las personas puedan desempeñarse de manera adecuada en el ámbito laboral. doyle   refiere a las soft skills como las características no técnicas que desarrolla una persona en la empresa. esto incluye cómo interactúa con sus compañeros de trabajo, que capacidad tiene para resolver problemas o cómo administra su trabajo. doyle   expone que las soft skills se complementan con las hard skills, habilidades que refieren a las competencias que se adquieren mediante formación y experiencia profesional. por ejemplo, en el área de recursos humanos se podrían resaltar las habilidades de llevar a cabo análisis de puestos y de perfiles, administrar los sistemas de compensación y liquidación de haberes, entre otras. por otro lado, gutierrez sernaque   expresa que en la actualidad, el tema de habilidades blandas ha tomado mayor relevancia al momento de evaluar el desempeño de los colaboradores, pues muchas veces el éxito o fracaso dependerá del desarrollo de estas p.  . de acuerdo con de la riva araluce   las habilidades personales blandas no sólo favorecen el buen ambiente de trabajo para la consecución de los objetivos propuestos, sino que también, soft skills como la iniciativa o la creatividad, ofrecen a la compañía la posibilidad de beneficiarse de una clara ventaja competitiva frente al resto de empresas del sector p.  . según delgado esquerre y sierra gonzales   , en los últimos años a nivel internacional en el ámbito laboral se habla mucho sobre las habilidades sociales o desarrollo de las habilidades blandas para mejorar el desempeño en el espacio laboral debido a que las personas transcurren gran parte del día en sus trabajos enfrentándose a múltiples problemas. los departamentos de recursos humanos de las organizaciones prioritariamente focalizan, desde la etapa de reclutamiento, la búsqueda y desarrollo de las relaciones interpersonales, actitud positiva, resiliencia, liderazgo, etc.']";"Licenciatura en Recursos Humanos"
"0";"20";"0_redes sociales_comunicación_trabajo_periodismo";"Comunicación Social: Periodismo y Participación Ciudadana en Redes";"['redes sociales', 'comunicación', 'trabajo', 'periodismo', 'sociedad', 'medios comunicación', 'periodistas', 'cobertura', 'provincia', 'juicio']";"['las manifestaciones de periodismo social en tucumán: el caso de el tucumano. el periodismo social busca ser transversal a toda producción de la prensa. tiene como objeto jerarquizar la información del tercer sector poniéndola en igualdad de importancia con la económica y política. este trabajo se planteó identificar, analizar y describir las manifestaciones de las producciones de periodismo social en un diario digital de tucumán. se desarrolló una investigación descriptiva que examinó los   artículos publicados por el diario digital el tucumano del   de enero al   de marzo de  . el estudio de las producciones permitió determinar que el tucumano es un medio hiperlocal que presenta notas de periodismo social generalmente en su sección de actualidad. las áreas temáticas más abordadas fueron mujer, género y justicia y acceso a la justicia; incorporando mayormente fuentes de la sociedad civil, difundiendo derechos y buscando que el lector actúe luego de interiorizarse sobre una problemática. en cuanto a las funciones, si bien la propuesta de soluciones es de las más importantes de la disciplina, este diario la cumple en un bajo porcentaje. sucede lo mismo con la función de brindar servicios. se concluye que el tucumano es un medio en el que el periodismo social se encuentra presente en un bajo porcentaje de su producción, pero a pesar de ello, lo trabaja de manera apropiada, visibilizando e incluyendo en sus artículos a sectores postergados de la sociedad.', 'la participación ciudadana en los medios de comunicación de salta y sus plataformas virtuales. la presente investigación consiste en un estudio de casos realizado a ocho medios masivos de comunicación de la ciudad de salta capital, pertenecientes al rubro de radio, televisión, prensa escrita y portal digital. mediante este trabajo se buscó conocer cómo se desarrolla el periodismo ciudadano en estos medios locales, y determinar si utilizan herramientas o programas online para medir la participación ciudadana en la web. se abordaron teorías vinculadas a la comunicación y a la evolución del periodismo en el tiempo hasta llegar al denominado periodismo ciudadano, participativo, o  . en cuanto a la metodología, se aborda la investigación desde una lógica deductiva de análisis de datos cualitativos y cuantitativos recolectados a través de cuestionarios abiertos dirigidos a periodistas y profesionales de los medios de comunicación. también se utilizó una grilla de análisis documental que registró la participación ciudadana en cada uno de los medios de comunicación. para esto se analizan sus plataformas digitales y redes sociales. respecto a los resultados, se logró conocer cómo funcionan los medios comunicación de salta; qué cambios internos tuvieron en estos últimos años; de qué manera interactúa el público; cuáles son las noticias que seleccionan y consumen preferentemente; por qué algunos medios tienen mayor feedback que otros; qué datos proporciona la analítica web; y por qué es importante analizar la audiencia en las plataformas online.', 'comunicación pública del gobierno municipal de la ciudad de salta : el plan de medios con foco en redes sociales durante el período  . el propósito de este trabajo es investigar y describir de qué manera se gestionó el plan de medios para la comunicación pública del gobierno municipal de la ciudad de salta en la red social instagram durante el período de aislamiento social, preventivo y obligatorio en  . a partir del período de confinamiento producto del covid   han cambiado los paradigmas de la comunicación de los gobiernos en el mundo. las redes sociales se han convertido en el medio fundamental para que las instituciones públicas permanezcan cerca de los ciudadanos y puedan, a su vez, visibilizar su gestión. la disciplina de la planificación de medios constituye una herramienta imprescindible para lograr una comunicación eficaz por parte de los gobiernos hacia los ciudadanos. la municipalidad de la ciudad de salta, encabezada por la intendencia de la dra. bettina romero, ha puesto sus esfuerzos en potenciar su cuenta oficial de instagram como estrategia para mantener la proximidad con los ciudadanos y mostrar que el gobierno local continuó trabajando durante el período de aislamiento. el trabajo de campo incluye el análisis de contenido de publicaciones seleccionadas de la cuenta oficial de la municipalidad de salta con el objetivo de analizar las características de las mismas durante el período  , describir el uso que se le ha dado a la red social y sus herramientas y determinar si se han empleado herramientas de planificación de medios para desplegar el plan de comunicación pública. también se cuenta con entrevistas al personal de la secretaría de prensa y comunicación de la municipalidad y con una encuesta realizada a ciudadanos de la capital de salta. los resultados indican que el gobierno local no recurrió a la disciplina de la planificación de medios como tal para aplicar una estrategia de comunicación en instagram, sino que utilizó algunas de sus herramientas de manera aislada para intentar adaptarse al nuevo paradigma comunicacional producto del confinamiento.']";"Licenciatura en Comunicaciones Sociales"
