"Topic";"Count";"Name";"CustomName";"Representation";"Representative_Docs";"carrera"
"-1";"35";"-1_trabajo_investigación_niños_adolescentes";"Documentos diversos";"['trabajo', 'investigación', 'niños', 'adolescentes', 'nivel', 'rol psicólogo', 'rugby', 'riesgo', 'violencia', 'licenciatura psicología']";"['las representaciones sociales sobre los jóvenes en conflicto con la ley penal del equipo de trabajo del programa de inclusión social y abordaje territorial, salta  . la presente investigación se enmarcó en el campo de la psicología social y se propuso describir las representaciones sociales sobre los jóvenes en conflicto con la ley penal que tiene el equipo de trabajo del programa de inclusión social y abordaje territorial. el trabajo de campo se llevó a cabo en el programa de inclusión social y abordaje territorial ubicado en la localidad de cerrillos, salta. la muestra estuvo conformada por   nueve integrantes del equipo de trabajo, la cual incluyo: operadores socio comunitarios, coordinación del programa y equipo técnico. se trata de una investigación abordada desde un enfoque cualitativo y desde un nivel descriptivo con un diseño fenomenológico. se utilizó como instrumento para la recolección de datos entrevistas semiestructuradas a partir de las cuales se construyeron las categorías de análisis que permitieron dar cuenta de las ideas, valoraciones e imágenes sobre los jóvenes en conflicto con la ley penal que tiene el equipo de trabajo del programa. se espera que los resultados contribuyan a un mayor interés en relación a los jóvenes que cumplen medidas penales en territorio puesto que es una población que no ha sido ampliamente investigada a nivel local al igual que el programa de inclusión social y abordaje territorial como dispositivo penal juvenil.', 'representaciones sociales sobre el abordaje intersectorial en el campo de la salud mental, en la comunidad de vaqueros salta. esta investigación se enmarca en la obtención del título de grado de licenciatura en psicología. el objeto de estudio se sitúa desde la perspectiva de la psicología socio comunitaria en el dominio de las representaciones psicológicas imágenes, palabras y valoraciones compartidas por los participantes de una red intersectorial en la comunidad de vaqueros municipio de la ciudad de salta, argentina durante el año  . a través de esta investigación de tipo cualitativa se buscó conocer las representaciones sociales que tienen los participantes de la red intersectorial en la comunidad de vaqueros salta, sobre la modalidad de abordaje en el campo de la salud mental, reconociendo los aspectos cognitivo, figurativo y valorativo de las mismas. asimismo se describen los límites y posibilidades de dicha representación en el campo estudiado. el proceso de investigación incluyó como técnicas de recolección de datos: la observación participante, cartografía social y árbol de problemas para conocer el contexto;   entrevistas a los integrantes de la red y un grupo de enfoque o focus group con los mismos así como también comunicaciones informales y fotografías que acompañaron a la triangulación de datos. a partir de la codificación y categorización realizada se pudo obtener cuatro categorías que guiaron el análisis de los datos: dos referidas al contexto tituladas vaqueros: muchas comunidades en una sola y lo institucional y las redes , y dos específicas del objeto de estudio: red vaqueriendo: una comunidad saludable y hablar y escuchar es hacer salud mental . esta última guía las conclusiones finales aduciendo que las representaciones sociales de la modalidad de abordaje en salud mental que tiene esta red intersectorial es entorno a la necesidad de diálogo y la posibilidad de escucha, así como también la promoción y prevención de la salud como eje principal en un trabajo en redes. sabiendo que este debe integrar a profesionales en casos específicos y reconociendo la importancia de generar la participación de otros sectores, en especial de la comunidad.', 'generando una base segura : intervención sobre las operadoras del hogar casita de belén. casita de belén es una institución privada que tiene por finalidad la protección y educación integral en forma gratuita destinada a niños carentes de recursos. asimismo, es una obra preventiva que alberga a niños en situación de riesgo, brindándoles una nutrición adecuada, apoyo escolar, catequesis, enseñanza de oficios, atención médica y actividades de recreación durante todo el año. esta organización sin fines de lucro tiene como principal sustento las donaciones producto de la generosidad de la sociedad. en los últimos años, casita de belén se comprometió a dar respuesta a un mayor número de necesidades de la comunidad, lo que llevó a: reabrir una segunda sede con niños internos, ampliar la edad de los niños que residen en la institución e incorporar niñas. hoy, la obra consta de dos sedes con internado para niños y niñas de entre   y   años distribuidos entre ambas sedes. por consiguiente, se contrató nuevo personal para seguir adelante con el objetivo institucional de: brindar protección al niño a, entre   a   años, en alto riesgo de caer en los vicios de la calle, a través de acciones que favorezcan su desarrollo integral, durante los   días del año casita de belén,  , p.  . la institución alberga tanto niños internos quienes residen en la n misma desde los domingos a la tarde hasta los sábados al mediodía como niños externos quienes permanecen durante el día para luego retornar a sus hogares la internación es voluntaria, es decir, la familia y el mismo niño son quienes deciden el ingreso y permanencia en la institución. es en las operadoras del hogar, en gran parte recientemente incorporadas, en quienes principalmente recae la importante tarea de una crianza que permita un desarrollo saludable e integral. las operadoras del hogar trabajan rotando turnos, de tal modo que, cada operadora tiene a su cuidado a todos los niños que residen en el hogar teniendo a la vez que realizar múltiples tareas como cocinar, limpiar, entre otras actividades establecidas en la disposición n.º   ver anexo . este proyecto de intervención implicó trabajar sobre las cuidadoras de los niños, quienes identificaron problemas causados por sus múltiples tareas, y dificultades relacionadas al respeto de los límites y conflictos generados entre los niños. la intervención, no sólo abordó las problemáticas mencionadas, sino también, se ocupó de trabajar el vínculo entre cuidadoras y niños, entendiendo que el mismo es fundamental para un desarrollo saludable. la importancia de los cuidadores en la infancia y la posibilidad de establecer vínculos seguros son fundamentales para la salud mental y para el desarrollo de los niños bowlby,  ,   . por ende, en aras de generar bases seguras, esta intervención buscó trasformar los vínculos entre operadores y niños, también, constituye constituyó la primera participación de las operadoras en una formación que aborda los vínculos en la infancia y los cuidados necesarios para un desarrollo saludable. por último, la intervención implicó aportar conocimientos y herramientas a las cuidadoras mediante talleres sobre las siguientes temáticas: vínculos de apego, características evolutivas, resolución de conflictos y pautas para poner límites adecuadamente. estos talleres, que se centraron exclusivamente en las edades de   a   años, tomaron como bases teóricas la teoría del apego propuesta por john bowlby y aportes de las neurociencias.']";"Licenciatura en Psicología"
"0";"25";"0_mujeres_participantes_violencia género_provincia salta";"Violencia de Género: Estudio de Casos en Mujeres Salteñas";"['mujeres', 'participantes', 'violencia género', 'provincia salta', 'entrevistas', 'presente investigación', 'capital', 'víctimas', 'relación', 'juegos']";"['prisión domiciliaria en mujeres : violencias y vulnerabilidad. el presente trabajo de investigación abordará acerca de las violencias y vulnerabilidades que anteceden al contexto carcelario, vivenciadas por mujeres con prisión domiciliaria que tienen niñas, niños y adolescentes a su cargo, residentes en la ciudad de salta capital y que dependen de la dirección de inserción social y supervisión de liberados de la provincia de salta en el periodo  . así mismo se pretende establecer una posible vinculación entre las violencias y las vulnerabilidades en las trayectorias de vida de las mujeres y las conductas delictivas por las cuales se encuentran privadas de libertad. a nivel metodológico esta investigación tiene un enfoque cualitativo de tipo descriptivo y un diseño de investigación narrativo. la investigación tuvo lugar en la ciudad de salta capital y la unidad de análisis son las mujeres usuarias de la dirección de inserción social y supervisión de liberados, que se encuentran con prisión domiciliaria, esta estuvo constituida por tres participantes determinadas por la directora de la dirección. los instrumentos utilizados para la recolección de información fueron el análisis de archivos, la observación participante y entrevistas profundas de tipo semiestructurada. esta investigación le proporcionó un espacio de escucha, para que las participantes en primera persona pudieran expresarse y de esta forma aportar al conocimiento de las diferentes realidades de las mujeres con prisión domiciliaria. entre los hallazgos de la investigación, se destaca que las trayectorias de vida de las mujeres estuvieron marcadas por múltiples violencias y vulnerabilidades desde la niñes presente en los vínculos con la familia de origen, carencias socio económicas y la violencia de genero dentro de las relaciones afectivas de pareja. se espera que los resultados de estes estudio tenga fines prácticos y constituyan una fuente de información para el ministerios de seguridad y justicia, en la dirección de inserción social y supervisión de presos y liberados, poder judicial, ministerio público y toda la administración de justicia para el abordaje integral con perspectiva de género en el trabajo con el colectivo de mujeres con prisión domiciliaria. además, se espera que los resultados promuevan el interés de comunidades educativas respecto a la problemática de la violencia de genero.', 'creencias irracionales y violencia de género : una mirada desde la terapia racional emotiva conductual sobre las mujeres víctimas de violencia de género en la pareja. la presente investigación surge con la finalidad de conocer las creencias irracionales de las mujeres de entre   y   años de edad víctimas de violencia de género en la pareja. se trata de una investigación cualitativa de nivel descriptivo, con un diseño de tipo fenomenológico. las participantes fueron doce mujeres víctimas de violencia de género en la pareja que asisten al área del servicio de asistencia de la dirección general área de la mujer del programa de protección a la víctima de violencia familiar , de la municipalidad de la ciudad de salta, durante el año  . se empleo como instrumento de investigación la entrevista individual semi dirigida y la observación fenomenológica. entre los resultados, se identificaron en las participantes las creencias irracionales formuladas por albert ellis, que interfieren en la consecución de sus metas y propósitos.', 'las representaciones sociales del personal de la policía de la provincia de salta sobre las mujeres que denuncian violencia de género en el año  . la presente investigación se enmarcó dentro del campo de la psicología social donde se propuso el estudio de las representaciones sociales del personal de la policía de la provincia de salta sobre las mujeres que denunciaron violencia de género en el periodo  . el enfoque utilizado fue cualitativo de tipo descriptivo donde se utilizó el diseño fenomenológico. las unidades de análisis fueron en total ocho participantes cuatro femeninos y cuatro masculinos de cargos oficiales y suboficiales de la policía de la provincia de salta. el instrumento de recolección de datos fueron las entrevistas semiestructuradas desde las cuales se realizó la construcción de categorías para el análisis. el marco teórico central de la investigación fue la teoría de las representaciones sociales y los aportes actuales desde una perspectiva de género. la pregunta eje de investigación fue cuáles son las representaciones sociales del personal de la policía de la provincia de salta sobre las mujeres que denunciaron violencia de género durante el período  ? a fines de responder esta pregunta de investigación se propuso como objetivo central el describir las representaciones sociales del personal de la policía de la provincia de salta sobre las mujeres que denunciaron violencia de género durante el período  . entre los hallazgos principales se reconoció que las y los policías poseen representaciones sociales sobre las mujeres que denuncian violencia de género aportando dos variables, la primera que las mujeres que denunciaron están atravesadas por problemáticas económicas y educacionales y, la segunda, que dichas mujeres son victimarias. los resultados obtenidos en este estudio servirán para futuras intervenciones e investigaciones, para la psicología en particular y las ciencias sociales en general. a su vez, aportará datos para mejorar la toma de denuncia en el personal policial de la provincia de salta ante las violencias de género y contribuirá a la erradicación de las violencias contra las mujeres.']";"Licenciatura en Psicología"
"1";"136";"1_salud_trabajo_ciudad salta_entrevistas";"Representaciones Psicosociales en la Inclusión Laboral de Jóvenes en Salta";"['salud', 'trabajo', 'ciudad salta', 'entrevistas', 'participantes', 'análisis', 'psicología', 'cualitativo', 'hospital', 'jóvenes']";"['representaciones sociales de los profesionales de salud mental sobre las modalidades de atención psicoterapéuticas implementadas durante el aislamiento social, preventivo y obligatorio, y su incidencia en la práctica actual. la pandemia por covid   ha tenido un profundo impacto en la prestación de servicios de salud mental en todo el mundo. en este contexto de desafíos sin precedentes, los profesionales de la salud mental se vieron obligados a adaptarse rápidamente para garantizar la continuidad de la atención psicoterapéutica. en esta investigación se exploraron las representaciones sociales de los profesionales de salud mental de los hospitales de iv nivel de complejidad de la ciudad de salta acerca de la modalidad de atención psicoterapéutica implementada durante el aislamiento social, preventivo y obligatorio de la emergencia sanitaria covid   y su incidencia en la práctica actual. para ello se abordaron los aspectos cognitivo, figurativo y valorativo de las modalidades de atención psicoterapéutica implementadas durante el periodo del aislamiento social, preventivo y obligatorio. identificando las modificaciones en la atención psicoterapéutica, y cómo éstas influyeron e influyen en la práctica actual. se utilizó una metodología de tipo cualitativa, de nivel descriptivo, y un diseño fenomenológico para la construcción y análisis de datos. se realizaron   entrevistas semiestructuradas a profesionales de los servicios de salud mental, tanto psicólogos como psiquiatras, de las siguientes instituciones: hospital san bernardo, hospital doctor arturo oñativia, hospital señor del milagro, hospital público materno infantil y hospital de salud mental doctor miguel ragone. entre los hallazgos más significativos se encontró que existieron representaciones sociales tanto de la modalidad de atención presencial como de la modalidad virtual. el trabajo de investigación también revela la transformación duradera en la forma en que se brinda atención a los pacientes, con la continuidad de la atención virtual después de levantadas las restricciones de la pandemia. esta investigación arroja luz sobre cómo los profesionales de salud mental se adaptaron a la pandemia de covid  , introduciendo cambios significativos en sus prácticas y modalidades de atención psicoterapéutica. la modalidad de atención virtual se ha convertido en una herramienta esencial y sostenible en salud mental en salta, argentina, marcando una nueva etapa en la prestación de la salud mental en tiempos de crisis, e instaurándose como una práctica que llegó para quedarse.', 'inclusión laboral de los usuarios del hospital de salud mental dr. miguel ragone, en la ciudad de salta, en el año  . el derecho al trabajo es un derecho humano fundamental, presente tanto en la convención sobre los derechos de las personas con discapacidad como en ley nacional de salud mental, al que deben acceder las personas con discapacidad ya que son titulares de los mismos derechos que el resto de los ciudadanos. el presente estudio cualitativo investigó sobre el proceso de inclusión laboral en el hospital de salud mental doctor miguel ragone en el año  . enmarcado dentro del enfoque de la psicología laboral incluyendo la perspectiva de salud mental y derechos humanos. se utilizó la entrevista cualitativa y el registro de observación. los participantes fueron nueve usuarios y seis referentes de la institución. por un lado, se entrevistó a los usuarios para recolectar datos respecto a los factores de empleabilidad. por otro lado, se entrevistó a los referentes para recabar datos respecto a los factores de ocupabilidad. la descripción de ambos factores permitió conocer como es el proceso de inclusión laboral de los usuarios del hospital de salud mental doctor miguel ragone. los resultados mostraron que los servicios con los que cuenta la institución para promover la inclusión social y laboral son el centro de día, el servicio de terapia ocupacional y el emprendimiento del kiosco los amigos . cada una de estas propuestas incluye diferentes actividades y talleres que buscan fomentar el crecimiento y desarrollo de habilidades para lograr la inclusión social y laboral de los usuarios. entre los hallazgos más significativos con respecto a los factores de empleabilidad se identificó el nivel de formación alcanzado por los usuarios, cuál es su ocupación actual, aspectos positivos y negativos, y cuáles fueron sus experiencias laborales previas. dentro de los factores sociales, cual es la influencia de la familia y los amigos. se detectaron competencias laborales, aspiraciones e intereses. también cuál es su percepción con respecto inclusión laboral y como podría mejorar. dentro de los factores de ocupabilidad desde la perspectiva de los referentes se logró identificar cual es la situación actual con respecto a la inclusión laboral de los usuarios, cuáles son las barreras u obstáculos que dificultan este proceso y cuales los facilitadores. como fue mejorando esta situación y como podría mejorar. también se logró reconocer cual es el rol de las familias y los prejuicios que continúan vigentes en la sociedad.', 'representaciones sociales sobre personas con padecimientos mentales en agentes de salud del primer nivel de atención : aportes para pensar prácticas novedosas en salud mental. esta investigación indagó en las representaciones sociales de las y los agentes de salud del primer nivel de atención en salud pública respecto a personas con padecimientos mentales. la investigación se realizó en cuatro centros de atención primaria en salud de la zona sur de la ciudad de salta, en el periodo octubre diciembre del año  . el marco teórico que orientó el proceso integra el estudio de las representaciones sociales desde la psicología social, y un análisis del proceso de reforma psiquiátrica en el sistema de salud pública que acontece a nivel local y global. en ese marco, se adoptan aportes de la salud mental comunitaria y nociones sobre salud y padecimiento mental entendidas como parte del proceso salud enfermedad atención. metodológicamente se adoptó un enfoque cualitativo, y un diseño de investigación exploratorio descriptivo desde la estrategia de teoría fundamentada. se realizaron dos entrevistas a informantes clave con cargos de gestión en el campo de la salud mental a nivel local, y dieciocho entrevistas en profundidad a agentes de salud de centros de salud, que desarrollan sus labores desde distintas disciplinas. entre los resultados principales se concluye que, en el marco de la reforma que propone la ley nacional de salud mental  , las representaciones sociales que los agentes de salud poseen sobre personas con padecimientos mentales presentan características estereotipadas, ligadas al riesgo y la discapacidad psico social. las representaciones en torno al proceso salud enfermedad atención de personas con padecimientos mentales se centran en una perspectiva clínica, con fuerte influencia del modelo de atención médico psiquiátrico. por último, se rescatan elementos de la perspectiva integral de los participantes que permitiría relativizar estereotipos y reduccionismos, y se esbozan algunas reflexiones sobre las relaciones entre representaciones prácticas en salud y el potencial de primer nivel de atención en este proceso de reforma en la atención de los padecimientos mentales.']";"Licenciatura en Psicología"
"2";"8";"2_poder judicial_poder_servicio psicología_pasantía académica";"Prácticas Forenses en Psicología Jurídica: Evaluación y Mediación.";"['poder judicial', 'poder', 'servicio psicología', 'pasantía académica', 'forense', 'mediación', 'rol psicólogo', 'psicólogo jurídico', 'judicial provincia', 'distrito centro']";"['el rol del psicólogo jurídico forense en la evaluación de postulantes a guarda con fines de adopción : pasantía académica en la secretaría tutelar del poder judicial de salta. el presente trabajo, enmarcado en calidad de trabajo final de grado de la carrera licenciatura en psicología de la ucasal, da cuenta de la realización de la pasantía académica llevada a cabo en la secretaria tutelar del poder judicial de salta, durante el transcurso del año  . la misma refleja una mirada que surge de la articulación teórica entre los conceptos psicoanalíticos y la experiencia enriquecedora de la práctica, a partir de la observación diaria de las intervenciones que lleva a cabo el psicólogo jurídico forense durante la evaluación de postulantes a guarda con fines de adopción.', 'el rol del psicólogo jurídico forense en causas de abuso sexual en el servicio de psicología área penal víctimas en el distrito centro del poder judicial de la provincia de salta, durante el año  . el presente trabajo integrador final, requerido para la finalización de la carrera de grado de licenciatura en psicología, expone la experiencia adquirida a partir del recorrido realizado en la pasantía académica llevada a cabo durante el año   en el área penal víctimas del servicio de psicología distrito centro del poder judicial de la provincia de salta. la temática principal que atraviesa esta experiencia es el trabajo con víctimas en causas de abuso sexual. las actividades efectuadas fueron realizadas bajo el acompañamiento y supervisión constante de la tutora institucional, quien facilitó el desenvolvimiento de la pasante a lo largo de la práctica efectuada. los objetivos generales y específicos se orientan a la adquisición de conocimientos teóricos y competencias prácticas como psicólogo jurídico forense, y a conocer acerca de las principales actividades que el mismo efectúa en el área penal víctimas : evaluaciones periciales, confección de informes periciales y entrevistas testimoniales bajo el sistema de circuito cerrado de televisión.', 'prácticas psicológicas periciales jurídico forenses en casos de violencias de género en el servicio de psicología del poder judicial de la provincia de salta distrito centro en el año  . la presente pasantía académica se llevó a cabo en el servicio de psicología del poder judicial de la provincia de salta distrito centro. se inició a fines de mayo y finalizó a comienzos de octubre del año  . la misma se desarrolló bajo la supervisión y acompañamiento de la lic. olga yahmila salomón plaza, perito oficial psicóloga del fuero penal del servicio de psicología del poder judicial. el trabajo de campo fue realizado los días lunes a viernes, de   am a   pm, en el cual se implementaron diferentes herramientas metodológicas como la observación participante, lectura de documentos institucionales, técnicas psicológicas psicométricas y proyectivas, bitácora de campo y entrevista psicológica semi dirigida a los usuarios del servicio de psicología. el objetivo general fue adquirir competencias teórico prácticas de la psicología jurídico forense en la atención de personas imputadas y condenadas por casos de violencia de género. mientras que los objetivos específicos fueron describir el rol del la psicólogo a jurídico forense que se desempeña en el servicio de psicología, identificar las características de la pericia psicológica a personas imputadas y condenadas por casos de violencia de género e incorporar saberes y actitudes vinculadas al rol del la psicólogo a en la atención de dichos casos.']";"Licenciatura en Psicología"
